{
  "kind": "system_compiler_result_map/v0",
  "mode": "summary",
  "input_bridge": {
    "summary_field": "system_input_summary",
    "root_fields": [
      "case_kind_matrix",
      "resolved_profile_matrix",
      "resolved_board_matrix",
      "resolved_active_facet_matrix"
    ],
    "field_relations": [
      {
        "root_field": "case_kind_matrix",
        "block_field_path": null,
        "block_relation": "none",
        "summary_field_path": "case_kind_matrix",
        "summary_relation": "same_field"
      },
      {
        "root_field": "resolved_profile_matrix",
        "block_field_path": null,
        "block_relation": "none",
        "summary_field_path": "resolved_profile_matrix",
        "summary_relation": "same_field"
      },
      {
        "root_field": "resolved_board_matrix",
        "block_field_path": null,
        "block_relation": "none",
        "summary_field_path": "resolved_board_matrix",
        "summary_relation": "same_field"
      },
      {
        "root_field": "resolved_active_facet_matrix",
        "block_field_path": null,
        "block_relation": "none",
        "summary_field_path": "resolved_active_facet_matrix",
        "summary_relation": "same_field"
      }
    ]
  },
  "case_projection_fields": {
    "formation": "cases[*].formation_basis",
    "binding": "cases[*].binding_summary",
    "bringup": "cases[*].bringup_summary"
  },
  "case_projection_field_relations": {
    "formation": [
      {
        "projection_field": "case_kind",
        "source_candidates": [
          {
            "stage": "system_formation",
            "field_path": "case_kind",
            "relation": "same_field"
          },
          {
            "stage": "system_input",
            "field_path": "case_kind",
            "relation": "same_field"
          }
        ]
      },
      {
        "projection_field": "declared_fact_count",
        "source_candidates": [
          {
            "stage": "system_formation",
            "field_path": "declared_fact_count",
            "relation": "same_field"
          },
          {
            "stage": "system_input",
            "field_path": "declared_fact_count",
            "relation": "same_field"
          }
        ]
      },
      {
        "projection_field": "declared_contract_count",
        "source_candidates": [
          {
            "stage": "system_formation",
            "field_path": "declared_contract_count",
            "relation": "same_field"
          },
          {
            "stage": "system_input",
            "field_path": "declared_contract_count",
            "relation": "same_field"
          }
        ]
      },
      {
        "projection_field": "subject_fact_count",
        "source_candidates": [
          {
            "stage": "system_formation",
            "field_path": "subject_fact_count",
            "relation": "same_field"
          },
          {
            "stage": "system_input",
            "field_path": "subject_fact_count",
            "relation": "same_field"
          }
        ]
      }
    ],
    "binding": [
      {
        "projection_field": "required_binding_count",
        "source_candidates": [
          {
            "stage": "system_formation",
            "field_path": "required_binding_count",
            "relation": "same_field"
          },
          {
            "stage": "binding_result",
            "field_path": "required_binding_count",
            "relation": "same_field"
          }
        ]
      },
      {
        "projection_field": "resolved_binding_count",
        "source_candidates": [
          {
            "stage": "system_formation",
            "field_path": "resolved_binding_count",
            "relation": "same_field"
          },
          {
            "stage": "binding_result",
            "field_path": "resolved_binding_count",
            "relation": "same_field"
          }
        ]
      },
      {
        "projection_field": "unresolved_binding_count",
        "source_candidates": [
          {
            "stage": "system_formation",
            "field_path": "unresolved_binding_count",
            "relation": "same_field"
          },
          {
            "stage": "binding_result",
            "field_path": "unresolved_binding_count",
            "relation": "same_field"
          }
        ]
      },
      {
        "projection_field": "resolved_capabilities",
        "source_candidates": [
          {
            "stage": "binding_result",
            "field_path": "resolved_capabilities",
            "relation": "same_field"
          }
        ]
      },
      {
        "projection_field": "unresolved_capabilities",
        "source_candidates": [
          {
            "stage": "system_formation",
            "field_path": "unresolved_capabilities",
            "relation": "same_field"
          },
          {
            "stage": "binding_result",
            "field_path": "unresolved_capabilities",
            "relation": "same_field"
          }
        ]
      }
    ],
    "bringup": [
      {
        "projection_field": "ordered_node_count",
        "source_candidates": [
          {
            "stage": "system_formation",
            "field_path": "ordered_node_count",
            "relation": "same_field"
          },
          {
            "stage": "bringup_order",
            "field_path": "ordered_node_count",
            "relation": "same_field"
          }
        ]
      },
      {
        "projection_field": "blocked_node_count",
        "source_candidates": [
          {
            "stage": "system_formation",
            "field_path": "blocked_node_count",
            "relation": "same_field"
          },
          {
            "stage": "bringup_order",
            "field_path": "blocked_node_count",
            "relation": "same_field"
          }
        ]
      },
      {
        "projection_field": "blocked_nodes",
        "source_candidates": [
          {
            "stage": "system_formation",
            "field_path": "blocked_nodes",
            "relation": "same_field"
          },
          {
            "stage": "bringup_order",
            "field_path": "blocked_nodes",
            "relation": "same_field"
          }
        ]
      },
      {
        "projection_field": "phase_counts",
        "source_candidates": [
          {
            "stage": "bringup_order",
            "field_path": "phase_counts",
            "relation": "same_field"
          }
        ]
      }
    ]
  },
  "stage_blocks": [
    {
      "stage": "formation",
      "block_field": "formation_basis",
      "summary_field": "system_formation_summary",
      "root_fields": [
        "status_counts",
        "formed_case_count",
        "blocked_case_count",
        "unresolved_capability_matrix",
        "blocked_node_matrix",
        "blocker_matrix",
        "blocker_reason_matrix",
        "blocker_missing_requires_matrix",
        "blocker_depends_on_matrix"
      ],
      "field_relations": [
        {
          "root_field": "status_counts",
          "block_field_path": "status_counts",
          "block_relation": "same_field",
          "summary_field_path": "status_counts",
          "summary_relation": "same_field"
        },
        {
          "root_field": "formed_case_count",
          "block_field_path": "formed_case_count",
          "block_relation": "same_field",
          "summary_field_path": "formed_case_count",
          "summary_relation": "same_field"
        },
        {
          "root_field": "blocked_case_count",
          "block_field_path": "blocked_case_count",
          "block_relation": "same_field",
          "summary_field_path": "blocked_case_count",
          "summary_relation": "same_field"
        },
        {
          "root_field": "unresolved_capability_matrix",
          "block_field_path": "unresolved_capability_matrix",
          "block_relation": "same_field",
          "summary_field_path": "unresolved_capability_matrix",
          "summary_relation": "same_field"
        },
        {
          "root_field": "blocked_node_matrix",
          "block_field_path": "blocked_node_matrix",
          "block_relation": "same_field",
          "summary_field_path": "blocked_node_matrix",
          "summary_relation": "same_field"
        },
        {
          "root_field": "blocker_matrix",
          "block_field_path": "blocker_matrix",
          "block_relation": "same_field",
          "summary_field_path": "blocker_matrix",
          "summary_relation": "same_field"
        },
        {
          "root_field": "blocker_reason_matrix",
          "block_field_path": "blocker_reason_matrix",
          "block_relation": "same_field",
          "summary_field_path": null,
          "summary_relation": "none"
        },
        {
          "root_field": "blocker_missing_requires_matrix",
          "block_field_path": "blocker_missing_requires_matrix",
          "block_relation": "same_field",
          "summary_field_path": null,
          "summary_relation": "none"
        },
        {
          "root_field": "blocker_depends_on_matrix",
          "block_field_path": "blocker_depends_on_matrix",
          "block_relation": "same_field",
          "summary_field_path": null,
          "summary_relation": "none"
        }
      ]
    },
    {
      "stage": "binding",
      "block_field": "binding_basis",
      "summary_field": "binding_result_summary",
      "root_fields": [
        "binding_reason_matrix",
        "unresolved_capability_matrix"
      ],
      "field_relations": [
        {
          "root_field": "binding_reason_matrix",
          "block_field_path": "reason_matrix",
          "block_relation": "field_alias",
          "summary_field_path": null,
          "summary_relation": "none"
        },
        {
          "root_field": "unresolved_capability_matrix",
          "block_field_path": "unresolved_capability_matrix",
          "block_relation": "same_field",